{
  "contract_version": "1.0.0",
  "document_kind": "lot_outline",
  "bbl": "5999999999",
  "outcome": "no_outline",
  "display_only": true,
  "crs": "EPSG:4326",
  "geometry": null,
  "feature_count": 0,
  "review_required": false,
  "no_outline_reason": "no_feature_for_bbl",
  "condo_classification": {
    "classification": "standard_lot",
    "condo_no": null,
    "note": null
  },
  "lot_identity": null,
  "source": {
    "source_id": "nyc-dcp-mappluto-arcgis",
    "service_root": "https://services5.arcgis.com/GfwWNkhOj9bNBqoJ/arcgis/rest/services",
    "layer": "MAPPLUTO",
    "endpoint": "https://services5.arcgis.com/GfwWNkhOj9bNBqoJ/arcgis/rest/services/MAPPLUTO/FeatureServer/0/query?where=BBL%3D5999999999&outFields=OBJECTID%2CBBL%2CBoroCode%2CBorough%2CBlock%2CLot%2CCondoNo%2CVersion%2CShape__Area%2CShape__Length&orderByFields=OBJECTID%20ASC&resultRecordCount=10&resultOffset=0&f=geojson&outSR=4326",
    "dataset_version": null,
    "retrieved_at": "2026-09-12T13:45:07Z"
  },
  "accuracy_note": "This is a DISPLAY-ONLY outline. The official NYC DCP source states plus-or-minus 20 ft horizontal accuracy, so the outline is approximate. No area, dimension, or other measurement is derived from these EPSG:4326 coordinates; authoritative measurement uses the EPSG:2263 (US survey feet) path only.",
  "attribution": "NYC Department of City Planning (DCP), MapPLUTO",
  "disclaimer": "Provided by NYC DCP for informational purposes only; DCP does not warranty completeness, accuracy, content, or fitness for any particular purpose or use. This is not a legal boundary survey.",
  "notes": [
    "no_outline: the official service returned a well-formed response with zero features for this BBL. This is a typed outcome, never an error and never a fabricated shape."
  ]
}
